"Please go to the Journal URL, find out when the journal started publishing under an OA model, and add the date in column H.",,,,,,,,,
Journal title,Journal URL,eISSN,URL in DOAJ,pISSN,Publisher,Country,OA Start,Man. Ed,
Gaceta Médica Boliviana,http://www.gacetamedicaboliviana.com/index.php/gmb,2227-3662,https://doaj.org/toc/16a63179efb14f5e85864ca114b1c423,1012-2966,"Universidad Mayor de San Simón, Facultad de Medicina","Bolivia, Plurinational State of",2014,Alejandra,
Ciencia Médica,https://rccm-umss.com/index.php/revistacientificacienciamedica/index,2220-2234,https://doaj.org/toc/5db2d5f3bc134cbbaa36c1abb5fab623,1817-7433,"Universidad Mayor de San Simón, Facultad de Medicina","Bolivia, Plurinational State of",2000,Alejandra,
Acervo,http://revista.arquivonacional.gov.br/,2237-8723,https://doaj.org/toc/990956a07f7e40c79b4dd0bf804edd70,0102-700X,Arquivo Nacional,Brazil,2014,Alejandra,
ABCustos,https://revista.abcustos.org.br/abcustos/index,1980-4814,https://doaj.org/toc/ef83b4a19445496eab9da6ead0885768,,Associação Brasileira de Custos,Brazil,2006,Alejandra,
Abehache,https://revistaabehache.com/ojs/index.php/abehache/index,2238-3026,https://doaj.org/toc/b6c10b13d8f14481a6ea6802a4b4c627,,Associação Brasileira de Hispanistas,Brazil,2011,Alejandra,
Revista Brasileira de Milho e Sorgo,http://rbms.cnpms.embrapa.br/index.php/ojs/index,1980-6477,https://doaj.org/toc/498a1292e22a431787cce66ebab8543c,1676-689X,Associação Brasileira de Milho e Sorgo,Brazil,2002,Alejandra,
Revista de Gestão de Água da América Latina,https://www.abrh.org.br/OJS/index.php/REGA/index,2359-1919,https://doaj.org/toc/fc2f126a0ced4466850c622266192a38,,Associação Brasileira de Recursos Hídricos – ABRHidro,Brazil,2018,Alejandra,
Estudos em Design,https://estudosemdesign.emnuvens.com.br/design/index,1983-196X,https://doaj.org/toc/55ca2d7f49994fba97e4cad8d9229cb1,0104-4249,Associação Estudos em Design,Brazil,2007,Alejandra,
Fineduca,https://seer.ufrgs.br/fineduca/,2236-5907,https://doaj.org/toc/fc7c668d28584ca19f5673dd2aa58cb2,,Associação Nacional de Pesquisa em Financiamento da Educação,Brazil,2011,Alejandra,
Soils and Rocks,https://www.soilsandrocks.com/,2675-5475,https://doaj.org/toc/82bc3686a4814e4b8f09a696a4908a21,1980-9743,Brazilian Association for Soil Mechanics and Geotechnical Engineering AND Portuguese Geotechnical Society,Brazil,2011,Alejandra,
Administração de Empresas em Revista,http://revista.unicuritiba.edu.br/index.php/admrevista/index,2316-7548,https://doaj.org/toc/9e51a009d5e74cc18e5173fa027eab05,1676-9457,Centro Universitário Curitiba,Brazil,2002,Alejandra,
Revista Juridica,http://revista.unicuritiba.edu.br/index.php/RevJur/index,2316-753X,https://doaj.org/toc/d2afde079f3a4af58c0a192d290f3471,0103-3506,Centro Universitário UNICURITIBA,Brazil,2007,Alejandra,
Khronos,https://www.revistas.usp.br/khronos/index,2447-2158,https://doaj.org/toc/fa8f9ae8f7ca4d658ccb3b8f46dd33bf,,CHC - Centro Interunidades de História da Ciência da Universidade de São Paulo,Brazil,2008,Alejandra,
Revista da Defensoria Pública do Distrito Federal,http://revista.defensoria.df.gov.br/,2674-5755,https://doaj.org/toc/8fba9fc27c6d4a70a62752cb384a340d,2674-5739,Defensoria Pública do Distrito Federal,Brazil,2019,Alejandra,
Educação Infantil Online,https://periodicos.editorialaar.com/index.php/educacaoinfantilonline/index,2675-9551,https://doaj.org/toc/4b15ac6cb60f45abb2485eb430000ea5,,EAAR -  Editorial Authors and Associated Researchers,Brazil,2021,Alejandra,
Linguagens nas Artes,https://revista.uemg.br/index.php/linguagensnasartes/index,2675-8741,https://doaj.org/toc/6aef9856eacb4ce487c04d72efa693fe,,Editora da Universidade do Estado de Minas Gerais,Brazil,2020,Alejandra,
Contradição,https://revista.unifatecie.edu.br/index.php/revcontrad/index,2675-7109,https://doaj.org/toc/29f3f4a4162a4d77bb732e4f34c689bb,,Edufatecie,Brazil,2021,Alejandra,
EntomoBrasilis,https://www.entomobrasilis.org,1983-0572,https://doaj.org/toc/f2c3592b369041559aef40e6420414f6,,Entomologistas do Brasil,Brazil,2008,Alejandra,
Revista da Defensoria Pública da União,https://revistadadpu.dpu.def.br/,2448-4555,https://doaj.org/toc/587782f1982641518564eedad5b75d36,1984-0322,Escola Nacional da Defensoria Pública da União,Brazil,2009,Alejandra,
Campo Jurídico,http://www.fasb.edu.br/revista/index.php/campojuridico/index,2317-4056,https://doaj.org/toc/e0195cc56d5645d087c4e03799219e51,2317-2444,Faculdade São Francisco de Barreiras - FASB,Brazil,2013,Alejandra,
Reunina,https://revista.unina.edu.br/index.php/re/index,2675-9721,https://doaj.org/toc/4472535606df4357b492d471e494a49b,,Faculdade Unina,Brazil,2020,Alejandra,
Revista de Ciências da Saúde Nova Esperança,https://revista.facene.com.br/index.php/revistane,2317-7160,https://doaj.org/toc/a07240991e944e74ad1abbab867d268c,1679-1983,Faculdades Nova Esperança,Brazil,2003,Alejandra,
Revista Calundu,https://periodicos.unb.br/index.php/revistacalundu,2526-9704,https://doaj.org/toc/b02ceb45bbe34345ad246399396b578b,,Grupo Calundu,Brazil,2018,Alejandra,
Revista Nova Paideia,http://ojs.novapaideia.org/index.php/RIEP,2674-5976,https://doaj.org/toc/9e85d0d2b85c44aaa86eb72fdfc8a5af,,Grupo Nova Paideia,Brazil,2019,Alejandra,
Revista Internacional de Pesquisa em Didática das Ciências e Matemática,https://periodicoscientificos.itp.ifsp.edu.br/index.php/revin/,2675-4258,https://doaj.org/toc/4b9abb0732b7496f8c84fb4110b9619f,,IFSP Itapetininga,Brazil,2020,Alejandra,
Citrus Research & Technology,https://citrusrt.ccsm.br/,2236-3122,https://doaj.org/toc/7094fa4b8ccf41468558da8f5c6e7621,2177-5419,Instituto Agronomico de Campinas/Centro de Citricultura Sylvio Moreira,Brazil,2006,Alejandra,
Revista do Instituto de Direito Constitucional e Cidadania,http://revistadoidcc.com.br/index.php/revista,2596-0075,https://doaj.org/toc/6432eec094fe42a1abe1650dc239d6eb,1808-9143,Instituto de Direito Constitucional e Cidadania,Brazil,2018,Alejandra,
LínguaTec,https://periodicos.ifrs.edu.br/index.php/LinguaTec/index,2525-3425,https://doaj.org/toc/1cbe3f10553a4a7c92180adce16ef6dc,,"Instituto Federal de Educação, Ciência e Tecnologia do Rio Grande do Sul (IFRS)",Brazil,2016,Alejandra,
Self,https://self.ijusp.org.br/self,2448-3060,https://doaj.org/toc/d7993fc516ab4a1e9b04bc12719bf7f4,,Instituto Junguiano de São Paulo,Brazil,2016,Alejandra,
Paubrasilia,https://periodicos.ufsb.edu.br/index.php/paubrasilia,2595-6752,https://doaj.org/toc/e051a49c1128448ba03965cadbfca38c,,Jardim Botânico FLORAS,Brazil,2018,Alejandra,
Demetra,https://www.e-publicacoes.uerj.br/index.php/demetra,2238-913X,https://doaj.org/toc/e8718384633b47d1ae37b90e25fcfba7,,Josely Correa Koury,Brazil,2012,Alejandra,
"Revista de Direito do Trabalho, Processo do Trabalho e Direito da Seguridade Social",https://revista.laborjuris.com.br/laborjuris,2674-6913,https://doaj.org/toc/91d2546ba4e44e63b08d7b04ca0d33c9,,Laborjuris Serviços Jurídicos em Educação,Brazil,2019,Alejandra,
Revista Educação e Políticas em Debate,http://www.seer.ufu.br/index.php/revistaeducaopoliticas/,2238-8346,https://doaj.org/toc/dc58e6e90e424ebc91e42714c80281f6,,Maria Vieira Silva,Brazil,2012,Alejandra,
Boletim do Museu Paraense Emílio Goeldi. Ciências Naturais,https://boletimcn.museu-goeldi.br/bcnaturais,2317-6237,https://doaj.org/toc/61023b9633824e30be54db0d958f1291,1981-8114,Museu Paraense Emílio Goeldi,Brazil,2006,Alejandra,
Pretextos,http://periodicos.pucminas.br/index.php/pretextos,2448-0738,https://doaj.org/toc/cd627ae4c588404a80bfa2effa726bb4,,Pontifícia Universidade Católica de Minas Gerais,Brazil,2016,Alejandra,
Teoria Jurídica Contemporânea,https://revistas.ufrj.br/index.php/rjur/index,2526-0464,https://doaj.org/toc/2dc62a5dfcd04352bcf0006618cb72a1,,Programa de Pós-Graduação em Direito da Universidade Federal do Rio de Janeiro,Brazil,2016,Alejandra,
Revista Informação na Sociedade Contemporânea,https://periodicos.ufrn.br/informacao/,2447-0198,https://doaj.org/toc/94b5aafddf514923802d2372768f30b2,,Programa de Pós-graduação em Gestão da Informação e do Conhecimento/Departamento de Ciência da Informação,Brazil,2014,Alejandra,
Licere,https://periodicos.ufmg.br/index.php/licere/index,1981-3171,https://doaj.org/toc/cdea1d025c9a48019bd88c5fa99ca9d4,1516-2168,Programa de Pós-Graduação Interdisciplinar em Estudos do lazer,Brazil,2009,Alejandra,
Revista de Ciências Farmacêuticas Básica e Aplicada,https://rcfba.fcfar.unesp.br/index.php/ojs/about,2179-443X,https://doaj.org/toc/2f53554066504172af844d85d87cd7a8,1808-4532,São Paulo State University (UNESP),Brazil,2010,Alejandra,
Revista da Faculdade de Direito UFPR,https://revistas.ufpr.br/direito/about,2236-7284,https://doaj.org/toc/39752ea483914716bb54943c0138caf7,,Sistema de Bibliotecas (SIBI) da Universidade Federal do Paraná,Brazil,2013,Alejandra,
Revista Enfermagem Atual in Derme,https://revistaenfermagematual.com/index.php/revista/home,2447-2034,https://doaj.org/toc/abc69f7be79c4ddf8b3c772f076ed8da,,Sociedade Brasileira de Enfermagem em Feridas e Estética,Brazil,2015,Alejandra,
Revista Brasileira de Sexualidade Humana,https://www.rbsh.org.br/,2675-1194,https://doaj.org/toc/a960a08c8d114ec89626d1567656d376,0103-6122,Sociedade Brasileira de Estudos em Sexualidade Humana (SBRASH),Brazil,2009,Alejandra,
Geochimica Brasiliensis,https://www.geobrasiliensis.org.br,2358-2812,https://doaj.org/toc/80c2c07eed494b2782687dd1830aa4e5,0102-9800,Sociedade Brasileira de Geoquímica,Brazil,2003,Alejandra,
Revista Brasileira de História da Matemática,http://www.rbhm.org.br/index.php/RBHM,2675-7079,https://doaj.org/toc/f66b07ba4d2d47f1acf3e181fd37b993,1519-955X,Sociedade Brasileira de História da Matemáticas (SBHMat),Brazil,2009,Alejandra,
Revista de Doutrina Jurídica,https://revistajuridica.tjdft.jus.br/index.php/rdj,2675-9640,https://doaj.org/toc/18ead3ad153f49d4a308ff29652ba56d,2675-9624,Tribunal de Justiça do Distrito Federal e dos Territórios,Brazil,2015,Alejandra,
ReDiPE,https://periodicos.unifesspa.edu.br/index.php/ReDiPE/,2675-2271,https://doaj.org/toc/52fea79b5677434b85d49f8b7204f286,,UNIFESSPA,Brazil,2019,Alejandra,
RGO. Revista Gestão Organizacional,http://bell.unochapeco.edu.br/revistas/index.php/rgo/index,1983-6635,https://doaj.org/toc/e19f594a9436490489d52719719f5149,1806-6720,Universidade Comunitária da Região de Chapecó,Brazil,2008,Alejandra,
Grifos,http://bell.unochapeco.edu.br/revistas/index.php/grifos/index,2175-0157,https://doaj.org/toc/c4cdde3f8072484c9847d27da8d05ca5,,Universidade Comunitária da Região de Chapecó,Brazil,2009,Alejandra,
Acta Ambiental Catarinense,http://bell.unochapeco.edu.br/revistas/index.php/acta/index,2175-1552,https://doaj.org/toc/65a9f9e416654797961db52d172e22c4,,Universidade Comunitária da Região de Chapecó,Brazil,2008,Alejandra,
Pólemos,https://periodicos.unb.br/index.php/polemos/index,2238-7692,https://doaj.org/toc/9acef36f4cd145c1884727d5600b802c,,Universidade de Brasília,Brazil,2012,Alejandra,
"Saúde, Ética & Justiça",https://www.revistas.usp.br/sej/index,2317-2770,https://doaj.org/toc/d5d934e51efe472db0ac056bc08b737d,1414-218X,Universidade de Sao Paulo,Brazil,2009,Alejandra,
Cadernos de Filosofia Alemã,https://www.revistas.usp.br/filosofiaalema,2318-9800,https://doaj.org/toc/4fbc7e8394194c4485ee86a4831abf7b,1413-7860,Universidade de São Paulo,Brazil,2012,Alejandra,
Matrizes,https://www.revistas.usp.br/matrizes/,1982-8160,https://doaj.org/toc/f3bf2ade5c774860b5d5e644e67b567a,1982-2073,Universidade de São Paulo,Brazil,2016,Alejandra,
Revista da Tulha,https://www.revistas.usp.br/revistadatulha/index,2447-7117,https://doaj.org/toc/2d25291a906247918152805fa04356bd,,Universidade de São Paulo,Brazil,2015,Alejandra,
Revista de Filosofia Antiga,https://www.revistas.usp.br/filosofiaantiga,1981-9471,https://doaj.org/toc/df24a24ba224464b99d50732fb052d89,,Universidade de São Paulo (USP),Brazil,2010,Alejandra,
Móin-Móin,https://www.revistas.udesc.br/index.php/moin/index,2595-0347,https://doaj.org/toc/51305857136c418cac7a8d62bd50a82a,1809-1385,Universidade do Estado de Santa Catarina,Brazil,2005,Alejandra,
Mural Internacional,https://www.e-publicacoes.uerj.br/index.php/muralinternacional/index,2177-7314,https://doaj.org/toc/b9f6e10cd7d142049926f28ea5925475,2446-6182,Universidade do Estado do Rio de Janeiro,Brazil,2010,Alejandra,
Ciencias Sociales y Religión,https://econtents.bc.unicamp.br/inpec/index.php/csr/index,1982-2650,https://doaj.org/toc/c489a824950b42139af4518cad74e95c,1518-4463,Universidade Estadual de Campinas,Brazil,2006,Alejandra,
Brazilian Journal of Oral Sciences,https://periodicos.sbu.unicamp.br/ojs/index.php/bjos,1677-3225,https://doaj.org/toc/5504fb75132e4bfe947dd7c24ee5c9e1,,Universidade Estadual de Campinas,Brazil,2012,Alejandra,
Imagens da Educação,https://periodicos.uem.br/ojs/index.php/ImagensEduc,2179-8427,https://doaj.org/toc/407fbd01ca824e6d961905fd4952c108,,Universidade Estadual de Maringá,Brazil,2011,Alejandra,
Olhar de Professor,https://revistas2.uepg.br/index.php/olhardeprofessor/index,1984-0187,https://doaj.org/toc/062ac509e5944d16892f448dfe5074ea,1518-5648,Universidade Estadual de Ponta Grossa,Brazil,2002,Alejandra,
"Revista de Instrumentos, Modelos e Políticas em Avaliação Educacional",https://revistas.uece.br/index.php/impa,2675-7427,https://doaj.org/toc/d574e9315c4642d4b8ee9f841feedb7e,,Universidade Estadual do Ceará,Brazil,2020,Alejandra,
Ensino em Perspectivas,https://revistas.uece.br/index.php/ensinoemperspectivas/index,2675-9144,https://doaj.org/toc/a5ce0074bddd458a8d470cd313af2164,,Universidade Estadual do Ceará,Brazil,2019,Alejandra,
Onomástica desde América Latina,http://e-revista.unioeste.br/index.php/onomastica/index,2675-2719,https://doaj.org/toc/ea44c9ec3f08472f85571634cf04032c,,Universidade Estadual do Oeste do Paraná,Brazil,2020,Alejandra,
Revista de Estudos em Educação e Diversidade,http://periodicos2.uesb.br/index.php/reed,2675-6889,https://doaj.org/toc/681a6080a42241f5809d68c6fb70aa0d,,Universidade Estadual do Sudoeste da Bahia (UESB),Brazil,2020,Alejandra,
Intermaths,https://periodicos2.uesb.br/index.php/intermaths/,2675-8318,https://doaj.org/toc/69c3c40a1fa3455a8d2ff6c3e8c55b1b,,Universidade Estadual do Sudoeste da Bahia (UESB),Brazil,2020,Alejandra,
Cadernos de Campo,https://periodicos.fclar.unesp.br/cadernos/index,2359-2419,https://doaj.org/toc/b5b311d553394b59bc939acad1888d99,1415-0689,Universidade Estadual Paulista Júlio de Mesquita Filho (UNESP),Brazil,1999,Alejandra,
Revista Baiana de Enfermagem,https://periodicos.ufba.br/index.php/enfermagem/index,2178-8650,https://doaj.org/toc/2ee387233167411aa66b8a50b7eb2874,0102-5430,Universidade Federal da Bahia,Brazil,2012,Alejandra,
Revista Direito e Sexualidade,https://periodicos.ufba.br/index.php/revdirsex/index,2675-3596,https://doaj.org/toc/3f193926223e4f5188f24fbbc5729a6b,,Universidade Federal da Bahia,Brazil,2020,Alejandra,
Afro-Ásia,https://periodicos.ufba.br/index.php/afroasia/index,1981-1411,https://doaj.org/toc/81fc185224344c659e6d318a2a17f777,0002-0591,Universidade Federal da Bahia - Centro de Estudos Afro-Orientais,Brazil,2009,Alejandra,
HU Revista,https://periodicos.ufjf.br/index.php/hurevista/index,1982-8047,https://doaj.org/toc/5fb212cdb46e41cdb3234b32cffce286,0103-3123,Universidade Federal de Juiz de Fora,Brazil,1996,Alejandra,
Libertas,https://periodicos.ufjf.br/index.php/libertas,1980-8518,https://doaj.org/toc/62ac0959822142359325a9b835aaf853,1518-9325,Universidade Federal de Juiz de Fora,Brazil,2007,Alejandra,
Pesquisa e Debate em Educação,https://periodicos.ufjf.br/index.php/RPDE,2237-9444,https://doaj.org/toc/dff9342e1b314cc593eeb8e7c695b881,2237-9436,Universidade Federal de Juiz de Fora,Brazil,2011,Alejandra,
E&S Engineering and Science,https://periodicoscientificos.ufmt.br/ojs/index.php/eng,2358-5390,https://doaj.org/toc/6d7144f0a054404787b09fdd394702dc,,Universidade Federal de Mato Grosso (UFMT),Brazil,2014,Alejandra,
Revista Eletrônica Trilhas da História,https://trilhasdahistoria.ufms.br/index.php/RevTH/issue/view/676,2238-1651,https://doaj.org/toc/06b65dbbde77443f916ac4a0321b6f01,,Universidade Federal de Mato Grosso do Sul,Brazil,2011,Alejandra,
GESTO-Debate,https://revistagestodebate.site123.me/,2595-3109,https://doaj.org/toc/4d452c9c2edc47a98f7b1d084ab03c4c,,Universidade Federal de Mato Grosso do Sul,Brazil,2017,Alejandra,
Cadernos NAUI,https://naui.ufsc.br/cadernos-naui/,2358-2448,https://doaj.org/toc/5cddee497f93412781386199b6f086d6,,Universidade Federal de Santa Catarina,Brazil,2012,Alejandra,
Contemporânea,http://www.contemporanea.ufscar.br/index.php/contemporanea/index,2316-1329,https://doaj.org/toc/ba31fdab2b1e40c08afee46dca979b14,2236-532X,Universidade Federal de São Carlos,Brazil,2011,Alejandra,
Olh@res,https://periodicos.unifesp.br/index.php/olhares/index,2317-7853,https://doaj.org/toc/a5b3a99e95c24c3987d722b7dff6afd5,,Universidade Federal de São Paulo,Brazil,2013,Alejandra,
Revista Sergipana de Educação Ambiental,https://seer.ufs.br/index.php/revisea,2359-4993,https://doaj.org/toc/766054fc016d4888bd8a3a032e3b654b,,Universidade Federal de Sergipe,Brazil,2014,Alejandra,
Ensino & Multidisciplinaridade,http://www.periodicoseletronicos.ufma.br/index.php/ens-multidisciplinaridade,2447-5777,https://doaj.org/toc/615ff6c336a045eda0d6a0015bfac321,,Universidade Federal do Maranhão,Brazil,2015,Alejandra,
Terra de Pretos,http://www.periodicoseletronicos.ufma.br/index.php/terradepretos/index,2675-7028,https://doaj.org/toc/dda76c89e4ea4d03abf816532dc631f7,,Universidade Federal do Maranhão,Brazil,2020,Alejandra,
Archives of Veterinary Science,https://revistas.ufpr.br/veterinary/index,2317-6822,https://doaj.org/toc/a1e1ce343c284fc6a8b7a5ca4d621337,1517-784X,Universidade Federal do Paraná,Brazil,1998,Alejandra,
DoisPontos,https://revistas.ufpr.br/doispontos/index,2179-7412,https://doaj.org/toc/cf6abc5cebc94e8cb3e7870475b89ae6,1807-3883,Universidade Federal do Paraná,Brazil,2004,Alejandra,
Revista X,https://revistas.ufpr.br/revistax/index,1980-0614,https://doaj.org/toc/8daca7b8c9bc4e89ba87742b487365d8,,Universidade Federal do Paraná,Brazil,2016,Alejandra,
Revista Geografar,https://revistas.ufpr.br/geografar/index,1981-089X,https://doaj.org/toc/3709d8a0358a465897bbd45ab735184e,,Universidade Federal do Paraná,Brazil,2006,Alejandra,
Extensão em Foco,https://revistas.ufpr.br/extensao/index,2358-7180,https://doaj.org/toc/2025cc234a8446cf8213e2a094ce2690,1982-4432,Universidade Federal do Paraná,Brazil,2008,Alejandra,
História do Direito,https://revistas.ufpr.br/historiadodireito/index,2675-9284,https://doaj.org/toc/15adfa7b91be438796b7b2997214d36f,,Universidade Federal do Paraná,Brazil,2020,Alejandra,
Revista Gearte,https://seer.ufrgs.br/gearte,2596-3198,https://doaj.org/toc/7f2a3d5403c54781bd34307da0f55121,2357-9854,Universidade Federal do Rio Grande do Sul,Brazil,2014,Alejandra,
Drug Analytical Research,https://seer.ufrgs.br/dar/index,2527-2616,https://doaj.org/toc/2a135bc56cd1419298bc2d7007d02afa,,Universidade Federal do Rio Grande do Sul,Brazil,2017,Alejandra,
Vivência,https://periodicos.ufrn.br/vivencia/index,2238-6009,https://doaj.org/toc/3757b5df0a234cadb55bf0a075b9efbf,,"Universidade Federal do Rio Grando do Norte, Programa de Pós-Graduação em Antropologia Social",Brazil,2004,Alejandra,
Revista Geographia,https://periodicos.uff.br/geographia/,2674-8126,https://doaj.org/toc/8c106eb1817741f2b4ad975a44fa936f,1517-7793,Universidade Federal Fluminense (UFF),Brazil,2014,Alejandra,
Horizontes,https://revistahorizontes.usf.edu.br/horizontes/home,2317-109X,https://doaj.org/toc/e08fa3d461de46a98c479190778e937e,0103-7706,Universidade São Francisco,Brazil,2012,Alejandra,
arq.urb,https://www.revistaarqurb.com.br,1984-5766,https://doaj.org/toc/5f7b089a95de4160b6cf22296cc3100c,,Universidade São Judas Tadeu Programa de Pós-Graduação Stricto Sensu em Arquitetura e Urbanismo,Brazil,2012,Alejandra,
Filosofia e História da Biologia,https://www.revistas.usp.br/fhb,2178-6224,https://doaj.org/toc/4aa40f6366814b998728c54ef43914fd,1983-053X,University of São Paulo (USP) / Brazilian Association of Philosophy and History of Biology (ABFHiB),Brazil,2020,Alejandra,
Dimensiones Turísticas,https://dimensionesturisticas.amiturismo.org/,2594-2069,https://doaj.org/toc/1b64f610ce174c1a9e653509039f22fc,,Academia Mexicana de Investigación Turística,Mexico,2017,Alejandra,
Revista ALCONPAT,https://revistaalconpat.org,2007-6835,https://doaj.org/toc/3d7dcf7f6e404f1aa46aab63dbe19f12,,"Asociación Latinoamericana de Control de Calidad, Patología y Recuperación de la Construcción",Mexico,2013,Alejandra,
Mextesol Journal,https://www.mextesol.net,2395-9908,https://doaj.org/toc/7e021be3856943568be6fde118d9ae70,,Asociación Mexicana de Maestros de Inglés,Mexico,2011,Alejandra,
Eirene Estudios de Paz y Conflictos,https://www.estudiosdepazyconflictos.com/index.php/eirene/index,2594-2883,https://doaj.org/toc/347d8cffc48a4d848c8e30859377e155,,"Eirene, Estudios de Paz y Conflictos A. C.",Mexico,2018,Alejandra,
Anuario de Letras Modernas,http://www.revistas.filos.unam.mx/index.php/anuariodeletrasmodernas,,https://doaj.org/toc/535f7a5e74c34b7aacd86969fec12714,0186-0526,"Facultad de Filosofía y Letras, Universidad Nacional Autónoma de México (UNAM)",Mexico,2011,Alejandra,
Nova Tellus,https://revistas-filologicas.unam.mx/nouatellus,2683-1759,https://doaj.org/toc/f37aab92d66b4dc89a0bfec72842eee2,0185-3058,Instituto de Investigaciones Filológicas - Centro de Estudios Clásicos,Mexico,2009,Alejandra,
Revista Colombiana de Cardiología,https://www.rccardiologia.com,2357-3260,https://doaj.org/toc/808c572cb80e407e90c62b93b03b143d,0120-5633,Permanyer,Mexico,2010,Alejandra,
Gaceta Mexicana de Oncología,https://www.gamo-smeo.com/,2565-005X,https://doaj.org/toc/524f0dbdd35940088921f42ef57b8e05,1665-9201,Permanyer,Mexico,2002,Alejandra,
Revista de la Alad. Asociación Latinoamericana de Diabetes,https://www.revistaalad.com,2248-6518,https://doaj.org/toc/8386fb25e8a2450abc638b10bd61b504,,Permanyer,Mexico,2006,Alejandra,
Revista Mexicana de Neurociencia,https://www.revmexneurociencia.com/,2604-6180,https://doaj.org/toc/f94c0ee9dcf44a0dafa9604da48320c8,,Permanyer,Mexico,2018,Alejandra,
Revista Latinoamericana de Herpetología,https://herpetologia.fciencias.unam.mx/index.php/revista,2594-2158,https://doaj.org/toc/3b031e73ca2d4be193debdc22f798388,,Sociedad Herpetológica Mexicana,Mexico,2018,Alejandra,
Fuentes Humanísticas,http://fuenteshumanisticas.azc.uam.mx/,2007-5618,https://doaj.org/toc/1663f2e85012470ab927a0ade598cd65,0188-8900,"UAM, Unidad Azcapotzalco, División de Ciencias Sociales y Humanidades",Mexico,2009,Alejandra,
The Anáhuac Journal,https://revistas.anahuac.mx/the_anahuac_journal,2683-2690,https://doaj.org/toc/604284758cdc4337b33bee44372a79da,1405-8448,Universidad Anáhuac del Sur,Mexico,2010,Alejandra,
Caleidoscopio,https://revistas.uaa.mx/index.php/caleidoscopio,2395-9576,https://doaj.org/toc/c5b92d12daa7461db02f01dc21690f9e,1405-7107,Universidad Autónoma de Aguascalientes,Mexico,2000,Alejandra,
Lux Médica,https://revistas.uaa.mx/index.php/luxmedica,2007-8714,https://doaj.org/toc/cae3f9d24934423f906db990e328c9f3,2007-1655,Universidad Autónoma de Aguascalientes,Mexico,2013,Alejandra,
Chihuahua Hoy,http://erevistas.uacj.mx/ojs/index.php/ChihuahuaHoy,2448-7759,https://doaj.org/toc/6a5a4d3a9da34759bd92ffe5d685056c,2448-8259,Universidad Autónoma de Ciudad Juárez,Mexico,2003,Alejandra,
Revista de Economía,https://www.revista.economia.uady.mx/index.php/reveco/index,2395-8715,https://doaj.org/toc/7e50b1b458bb49ef94e5f053eae5b728,,Universidad Autónoma de Yucatán,Mexico,2009,Alejandra,
Revista de Psicología,https://hemeroteca.uaemex.mx/index.php/rpsicologia,2007-7149,https://doaj.org/toc/5b78907ca23c4176b5c9bdd315fb003a,,Universidad Autónoma del Estado de México,Mexico,2016,Alejandra,
Denarius,https://denarius.izt.uam.mx/index.php/denarius,2448-5403,https://doaj.org/toc/bbbf2b75db9f4da68ef124d1f2d34107,,Universidad Autónoma Metropolitana,Mexico,2008,Alejandra,
Alteridades,https://alteridades.izt.uam.mx,2448-850X,https://doaj.org/toc/6e2cf5c69bd1479cb226cfa00938ce39,0188-7017,Universidad Autónoma Metropolitana Unidad Iztapalapa,Mexico,2010,Alejandra,
Diagnóstico FACIL Empresarial Finanzas Auditoria Contabilidad Impuestos Legal,http://dfe.cucea.udg.mx/index.php/dfe/index,2683-1481,https://doaj.org/toc/e3e6944246be4180988b79e2d5f9deea,2007-2147,Universidad de Guadalajara,Mexico,2014,Alejandra,
Psicumex,https://psicumex.unison.mx/index.php/psicumex,2007-5936,https://doaj.org/toc/f3b61973a3404b1c8b2fb044eda554df,,Universidad de Sonora,Mexico,2011,Alejandra,
Connotas. Revista de Crítica y Teoría Literarias,https://connotas.unison.mx,2448-6019,https://doaj.org/toc/acf934a1530640bea2a0486981cc61af,,Universidad de Sonora,Mexico,2003,Alejandra,
Revista Latinoamericana de Estudios Educativos,https://rlee.ibero.mx/index.php/rlee,2448-878X,https://doaj.org/toc/5a4e824beddc4596985db2655ecd14cf,0185-1284,Universidad Iberoamericana,Mexico,2009,Alejandra,
Sobre México,https://sobremexico-revista.ibero.mx/index.php/Revista_Sobre_Mexico,2448-7325,https://doaj.org/toc/03bbc7e0be784d05bc316c73c38e94c2,,Universidad Iberoamericana,Mexico,2015,Alejandra,
Estudios de Historia Moderna y Contemporánea de México,https://moderna.historicas.unam.mx,2448-5004,https://doaj.org/toc/0460a092992a438ca93e279204a53712,0185-2620,Universidad Nacional Autónoma de México,Mexico,2010,Alejandra,
Estudios de Historia Novohispana,https://novohispana.historicas.unam.mx,2448-6922,https://doaj.org/toc/cc6300003c704a3caaf57885602e34eb,,Universidad Nacional Autónoma de México,Mexico,2010,Alejandra,
Interpretatio. Revista de Hermenéutica,https://revistas-filologicas.unam.mx/interpretatio,2448-864X,https://doaj.org/toc/9f0282ed05e0490693b2b6d7ea85dbfd,2683-1406,Universidad Nacional Autónoma de México,Mexico,2016,Alejandra,
